iteration	score	status	description
0	57	baseline	以新的二创合作申请文案作为起点，原文表达真诚但比较笼统
1	60	keep	把标题从“想做”改成“想申请做”，语气更明确
2	62	keep	删除正文里重复的“切片切片”，避免口语性重复
3	62	discard	尝试把语气改得更热情，但显得过分讨好
4	65	keep	把“做得相当不错”改成更具体的“覆盖面和更新频率都很强”
5	65	discard	加入“爆火”“做大”等词，显得目的性过强
6	68	keep	把“更深入更懂你”改写成“更认真、更懂内容风格”
7	68	discard	改成过于正式的商务措辞，失去自然感
8	70	keep	增加“不是泛泛搬运”的对比，意图更清楚
9	70	discard	在标题里堆更多修饰词，读起来变重
10	72	keep	把“如果获得同意我就开始”改成更礼貌的授权表达
11	72	discard	直接要求授权，动作有点太快
12	75	keep	加入“长期”信号，表达不是短期蹭热点
13	75	discard	加入太多自我表态，正文重心失衡
14	78	keep	补充“内容风格”这一层，让理解对象更具体
15	78	discard	尝试加入过多夸赞，显得不够克制
16	82	keep	增加“先做 1 条样片”，把请求从抽象变成可执行动作
17	82	discard	直接提出连续做多条，门槛偏高
18	85	keep	补充“选题、节奏、标题、封面”四个具体交付点
19	85	discard	继续增加执行细节，正文开始显得啰嗦
20	88	keep	把“给您看”放进动作闭环，降低对方决策压力
21	88	discard	结尾改成催促回复，破坏礼貌感
22	90	keep	把“得到您的同意后，我再正式开始”写清，边界更清楚
23	90	discard	尝试更激进的行动号召，不符合合作申请语境
24	93	keep	补上“感谢您抽空看这封邮件”，结尾更完整
25	93	discard	加入多余承诺，开始有讨好感
26	95	keep	进一步压缩冗余口语，让句子更干净
27	95	discard	尝试更短标题，但损失了合作申请的明确度
28	97	keep	优化第二段节奏，形成“认可现状 -> 表明差异化”的结构
29	100	keep	定稿为当前终稿，兼顾尊重、清晰和可执行下一步
30	100	final	30轮结束，保留最终版本作为结果输出
